{
  "schema_identity": "infinium.repository.m1-slice6-successor-runtime-candidate/2.0.0",
  "candidate_id": "m1-s6-successor-v6-wp9-runtime-candidate-5/be7af69d-7496-43a8-a8e9-81a97ba3e52e",
  "campaign": {
    "id": "infinium.m1-s6.successor-campaign-v6/20260821-hard-budget",
    "sha256": "41dc8f4c31461f10ec4da68ff8a0c65284b23bbdeec6489cc6d09347c6643a98"
  },
  "subject_manifest": {
    "id": "infinium.m1-s6.successor-stage-v6/WP9/attempt-5/f4120b77-8363-45a4-a87f-b1ea44c666ac",
    "sha256": "1034fe08041b40ecf5d5efb70c22fd25401117b53d445ba631b1aea039d311df"
  },
  "predecessor": {
    "ledger_event_hash": "2c9bf2096cc3313bdc656b78ee24a35cda8167140a991159a63335eba4d166b1",
    "evidence_id": "infinium.m1-s6.successor-offline-correction-review-v3/WP9/attempt-4/b8a744f2-e65d-484f-ab9a-6fc18c334c45",
    "evidence_sha256": "7fc623e9c8169af8caeb0ee78f9b559322ad2bf243eb6747532e0aee08656cc9"
  },
  "attempt": {
    "attempt_id": "m1-s6-successor-v6-wp9-attempt-5/075cdd79-b966-4fbc-888a-13face5e7156",
    "attempt_ordinal": 5,
    "request_id": "m1-s6-successor-v6-wp9-request-5/cceecc09-9ee8-43df-9ce4-1012f11ef4af",
    "reservation_id": "m1-s6-successor-v6-wp9-reservation-5/c2defca7-56f7-4bec-9570-51e1418417da",
    "dispatch_fence_id": "m1-s6-successor-v6-wp9-fence-5/de245b00-779d-44ae-9f94-88542ce80a6b"
  },
  "credential_access": {
    "id": "infinium.m1-s6.successor-credential-access-v2/20260821-hard-budget",
    "sha256": "5c76484a5835bb118a7143da25369b9571d96c39d8f533dcce1534f0b3ec84a6"
  },
  "implementation_commit": "0cc6feb7509420e46e16ae07fdc3049dccdb1e92",
  "coordinator_sha256": "189f32e1a666aad257e553006a03d6813af96138629e046404c6d0595e8a8535",
  "helper_sha256": "f02781d8b564f4760dada3e4913913bf0a1d22d917e62d48a386f3bbae834ae3",
  "execution": {
    "output_root_relative": "artifacts/m1-slice6/successor-campaign",
    "ledger_path_relative": "artifacts/m1-slice6/successor-campaign/ledger.v3.jsonl",
    "evidence_path_relative": "artifacts/m1-slice6/successor-campaign/wp9-attempt-5-10c876ace0a24b50b5102915028bb7d9/attempt-evidence.v3.json",
    "product_state_root_absolute": "C:/Users/vex/.codex/worktrees/223b/infinium/artifacts/m1-slice6/successor-product-state",
    "product_state_snapshot_origin_sha256": "e3d23f0a11d66c243fd857e66e741d957abb8d470b45d653ae53f17d74fe4945",
    "product_state_checkpoint_sha256": "e959a8eccfed79fbfbb54e8e82628c7b0f17cd4b5c6f1d1059e0b6fc161beaed",
    "coordinator_path_relative": "src/Infinium.Coordinator/bin/Release/net10.0/Infinium.Coordinator.exe",
    "helper_path_relative": "src/Infinium.CredentialHelper/bin/Release/net10.0/Infinium.CredentialHelper.exe"
  },
  "limits": {
    "helper_launches": 1,
    "credential_native_calls": 2,
    "provider_starts": 1,
    "dns_resolutions": 1,
    "billable_operations": 1,
    "automatic_retry": false
  }
}
