{
  "schema_identity": "infinium.repository.m1-slice6-successor-runtime-candidate/2.0.0",
  "candidate_id": "m1-s6-successor-v6-wp9-runtime-candidate-7/3816b043-82a7-4387-9bd9-13b1b6c8fb76",
  "campaign": {
    "id": "infinium.m1-s6.successor-campaign-v6/20260821-hard-budget",
    "sha256": "41dc8f4c31461f10ec4da68ff8a0c65284b23bbdeec6489cc6d09347c6643a98"
  },
  "subject_manifest": {
    "id": "infinium.m1-s6.successor-stage-v6/WP9/attempt-7/9cdf94dc-3d1e-41b2-873c-c5094dc9295c",
    "sha256": "743f149389c04bd8e4317de3e67fe593a45bfcb975f3f51bc8ae81065101db9e"
  },
  "predecessor": {
    "ledger_event_hash": "e90a69986d8cc53b092eb92a36c2b69180d92514a77721bdac6cc81f48d49549",
    "evidence_id": "infinium.m1-s6.successor-offline-correction-review-v3/WP9/attempt-6/c887282a-0caf-4508-a38e-60256241f612",
    "evidence_sha256": "c749439b5367120841fd3f97b277db912b44b3b0d71ce5d1366591257fe46df7"
  },
  "attempt": {
    "attempt_id": "m1-s6-successor-v6-wp9-attempt-7/bc776096-5833-45c1-b6b1-435732edea30",
    "attempt_ordinal": 7,
    "request_id": "m1-s6-successor-v6-wp9-request-7/e5214d13-b10d-4e70-bcb6-2d4ec3b549e9",
    "reservation_id": "m1-s6-successor-v6-wp9-reservation-7/fccd79e1-cac0-443a-b7d5-b13cf5a1d4c7",
    "dispatch_fence_id": "m1-s6-successor-v6-wp9-fence-7/e43403d9-fdce-473c-bd04-b6a4397fe20f"
  },
  "credential_access": {
    "id": "infinium.m1-s6.successor-credential-access-v2/20260821-hard-budget",
    "sha256": "5c76484a5835bb118a7143da25369b9571d96c39d8f533dcce1534f0b3ec84a6"
  },
  "implementation_commit": "7a5d8accbd7a7b087319bea0b91fd83799866602",
  "coordinator_sha256": "628560ec8e23fd409264e6da6d9cea37b5481bf068e588d0cc6ce9d344d111aa",
  "helper_sha256": "f79c9bb32273a12b1cc6304a92ac717e274f9bcff66444f1d65a75dc8b22026e",
  "execution": {
    "output_root_relative": "artifacts/m1-slice6/successor-campaign",
    "ledger_path_relative": "artifacts/m1-slice6/successor-campaign/ledger.v3.jsonl",
    "evidence_path_relative": "artifacts/m1-slice6/successor-campaign/wp9-attempt-7-6506e3dbde7c45dfa305db6253d1eda3/attempt-evidence.v3.json",
    "product_state_root_absolute": "C:/Users/vex/.codex/worktrees/223b/infinium/artifacts/m1-slice6/successor-product-state",
    "product_state_snapshot_origin_sha256": "e3d23f0a11d66c243fd857e66e741d957abb8d470b45d653ae53f17d74fe4945",
    "product_state_checkpoint_sha256": "2a6476c0dd0a7261c56d93ecf50c6134f4233b5de989af6dc6853fec5f10ad61",
    "coordinator_path_relative": "src/Infinium.Coordinator/bin/Release/net10.0/Infinium.Coordinator.exe",
    "helper_path_relative": "src/Infinium.CredentialHelper/bin/Release/net10.0/Infinium.CredentialHelper.exe"
  },
  "limits": {
    "helper_launches": 1,
    "credential_native_calls": 2,
    "provider_starts": 1,
    "dns_resolutions": 1,
    "billable_operations": 1,
    "automatic_retry": false
  }
}
