{
  "schema_identity": "infinium.repository.m1-slice6-successor-runtime-candidate/2.0.0",
  "candidate_id": "m1-s6-successor-v6-wp9-runtime-candidate-3/66622f64-d786-45e1-839a-bb82dddce229",
  "campaign": {
    "id": "infinium.m1-s6.successor-campaign-v6/20260821-hard-budget",
    "sha256": "41dc8f4c31461f10ec4da68ff8a0c65284b23bbdeec6489cc6d09347c6643a98"
  },
  "subject_manifest": {
    "id": "infinium.m1-s6.successor-stage-v6/WP9/attempt-3/df99d6fe-2a8c-4974-9563-c7b74359ee02",
    "sha256": "87cb26a1e2bbf0701a1a44e07dbbe1d7e65ee0fe661ad7e570e27488efdf14ed"
  },
  "predecessor": {
    "ledger_event_hash": "be2ed26662bbc0d2df1b540817ac930fa411707a627d0c01de503db905fd1f1f",
    "evidence_id": "infinium.m1-s6.hard-budget-continuation/20260821-c2b-c3",
    "evidence_sha256": "a79502da0ebea9ded5f6b10b72ad70f8b482d9de28e97e3bd09541936683a5b3"
  },
  "attempt": {
    "attempt_id": "m1-s6-successor-v6-wp9-attempt-3/ddd0000d-7ad7-4526-9d0b-de60d4911644",
    "attempt_ordinal": 3,
    "request_id": "m1-s6-successor-v6-wp9-request-3/d1d006ff-2be2-4b4e-8e26-0ae753d410f8",
    "reservation_id": "m1-s6-successor-v6-wp9-reservation-3/0f6de5c3-b890-44b0-9dfb-b9d6e97b8427",
    "dispatch_fence_id": "m1-s6-successor-v6-wp9-fence-3/9fc6e083-b8e8-4079-8cb5-7dbfa238617d"
  },
  "credential_access": {
    "id": "infinium.m1-s6.successor-credential-access-v2/20260821-hard-budget",
    "sha256": "5c76484a5835bb118a7143da25369b9571d96c39d8f533dcce1534f0b3ec84a6"
  },
  "implementation_commit": "640a5273d09d0c3465990f72919f95dc25a90c29",
  "coordinator_sha256": "4970ed9b00c826e6e591bf686998df92f564c5ba96d25cb38bdd034e631aa256",
  "helper_sha256": "f51c79d09cc02fed0bcdba32dce0bc8162bd15c0bea3ce2f92b8bc70041e7156",
  "execution": {
    "output_root_relative": "artifacts/m1-slice6/successor-campaign",
    "ledger_path_relative": "artifacts/m1-slice6/successor-campaign/ledger.v3.jsonl",
    "evidence_path_relative": "artifacts/m1-slice6/successor-campaign/wp9-attempt-3-rederived-6b6d3e0f5adb4caab504c5a56f986c29/attempt-evidence.v3.json",
    "product_state_root_absolute": "C:/Users/vex/.codex/worktrees/223b/infinium/artifacts/m1-slice6/successor-product-state",
    "product_state_snapshot_origin_sha256": "e3d23f0a11d66c243fd857e66e741d957abb8d470b45d653ae53f17d74fe4945",
    "product_state_checkpoint_sha256": "c4bc0295273c00ef5319f667e5c8fdcefdf0404703487f511d6b4bf76ab50b3d",
    "coordinator_path_relative": "src/Infinium.Coordinator/bin/Release/net10.0/Infinium.Coordinator.exe",
    "helper_path_relative": "src/Infinium.CredentialHelper/bin/Release/net10.0/Infinium.CredentialHelper.exe"
  },
  "limits": {
    "helper_launches": 1,
    "credential_native_calls": 2,
    "provider_starts": 1,
    "dns_resolutions": 1,
    "billable_operations": 1,
    "automatic_retry": false
  }
}
