{
  "schema_identity": "infinium.repository.m1-slice6-successor-runtime-candidate/2.0.0",
  "candidate_id": "m1-s6-successor-v6-wp9-runtime-candidate-3/51ba8192-3069-44d1-8e33-58cb80b313c7",
  "campaign": {
    "id": "infinium.m1-s6.successor-campaign-v6/20260821-hard-budget",
    "sha256": "41dc8f4c31461f10ec4da68ff8a0c65284b23bbdeec6489cc6d09347c6643a98"
  },
  "subject_manifest": {
    "id": "infinium.m1-s6.successor-stage-v6/WP9/attempt-3/bb2f2e3b-636a-4063-ada6-4cb3331b32e9",
    "sha256": "e09ca6ac30df41feea93a09c46c3f79a825502ec4a1fa33b3330d3e5eb31bdaa"
  },
  "predecessor": {
    "ledger_event_hash": "be2ed26662bbc0d2df1b540817ac930fa411707a627d0c01de503db905fd1f1f",
    "evidence_id": "infinium.m1-s6.hard-budget-continuation/20260821-c2b-c3",
    "evidence_sha256": "a79502da0ebea9ded5f6b10b72ad70f8b482d9de28e97e3bd09541936683a5b3"
  },
  "attempt": {
    "attempt_id": "m1-s6-successor-v6-wp9-attempt-3/8e47e73a-a3cf-4a4c-8584-a735db771ca6",
    "attempt_ordinal": 3,
    "request_id": "m1-s6-successor-v6-wp9-request-3/153d251f-3e20-4fce-b3a5-b782d89b1064",
    "reservation_id": "m1-s6-successor-v6-wp9-reservation-3/a5e9721e-ca4b-4337-a9d6-1c7906a99805",
    "dispatch_fence_id": "m1-s6-successor-v6-wp9-fence-3/d23e61c1-d539-4eca-9c4e-6f2f68ea2ceb"
  },
  "credential_access": {
    "id": "infinium.m1-s6.successor-credential-access-v2/20260821-hard-budget",
    "sha256": "5c76484a5835bb118a7143da25369b9571d96c39d8f533dcce1534f0b3ec84a6"
  },
  "implementation_commit": "3e7706f4a5bf2360365b333ec90bf18b817f843f",
  "coordinator_sha256": "3a165f86b56cc38ef9502a49d8d2555a3733ee2697e86dd5fef349baac0cdf13",
  "helper_sha256": "1be7ea6d24e7e3a9160d363d8bd719e67d18a5b9653813cd61f4532bf586c029",
  "execution": {
    "output_root_relative": "artifacts/m1-slice6/successor-campaign",
    "ledger_path_relative": "artifacts/m1-slice6/successor-campaign/ledger.v3.jsonl",
    "evidence_path_relative": "artifacts/m1-slice6/successor-campaign/wp9-attempt-3-rederived-ff08de20367c4b719c74dc2d866fe7d7/attempt-evidence.v3.json",
    "product_state_root_absolute": "C:/Users/vex/.codex/worktrees/223b/infinium/artifacts/m1-slice6/successor-product-state",
    "product_state_snapshot_origin_sha256": "e3d23f0a11d66c243fd857e66e741d957abb8d470b45d653ae53f17d74fe4945",
    "product_state_checkpoint_sha256": "c4bc0295273c00ef5319f667e5c8fdcefdf0404703487f511d6b4bf76ab50b3d",
    "coordinator_path_relative": "src/Infinium.Coordinator/bin/Release/net10.0/Infinium.Coordinator.dll",
    "helper_path_relative": "src/Infinium.CredentialHelper/bin/Release/net10.0/Infinium.CredentialHelper.dll"
  },
  "limits": {
    "helper_launches": 1,
    "credential_native_calls": 2,
    "provider_starts": 1,
    "dns_resolutions": 1,
    "billable_operations": 1,
    "automatic_retry": false
  }
}
